{
  "$schema": "http://json-schema.org/draft-07/schema#",
  "title": "boring.json",
  "type": "object",
  "required": [
    "schema_version"
  ],
  "properties": {
    "$schema": {
      "type": "string"
    },
    "schema_version": {
      "type": "integer",
      "minimum": 1,
      "description": "Schema version. Higher versions are loaded with a warning."
    },
    "note_lang": {
      "type": "string",
      "enum": [
        "auto",
        "ko",
        "en"
      ],
      "default": "auto",
      "description": "Output language for distilled notes (ko/en/auto)."
    },
    "llm": {
      "type": "object",
      "description": "LLM connection + bootstrap policy (v2). The engine is OpenAI-compatible and backend-agnostic; `provider` steers only the host-side bootstrap (model pull / daemon ensure / health probe). Runtime env (BORING_LLM_*) still overrides.",
      "properties": {
        "provider": {
          "type": "string",
          "enum": [
            "ollama",
            "lmstudio",
            "openai-compatible"
          ],
          "default": "ollama",
          "description": "ollama = ensure serve + pull models. lmstudio = OpenAI /v1, models loaded via its UI/`lms` (no pull). openai-compatible = vLLM/llama.cpp/remote OpenAI (no pull)."
        },
        "base_url": {
          "type": "string",
          "default": "http://host.docker.internal:11434/v1",
          "description": "OpenAI-compatible base URL. LM Studio is usually http://localhost:1234/v1."
        },
        "model": {
          "type": "string",
          "default": "qwen3:14b",
          "description": "Chat/synthesis model — used only by the ask/brief generation path."
        },
        "embed_model": {
          "type": "string",
          "default": "bge-m3",
          "description": "Embedding model — the only model drudge itself calls (kernel A). Authoritative when set."
        },
        "embed_dim": {
          "type": "integer",
          "minimum": 1,
          "default": 1024,
          "description": "Embedding dimension. MUST match embed_model's output (bge-m3=1024, nomic-embed-text=768, OpenAI 3-small=1536). Changing it needs `make reset` (vectors are reshaped)."
        },
        "api_key_env": {
          "type": "string",
          "default": "BORING_LLM_API_KEY",
          "description": "Name of the env var holding the API key (providers that need auth). The key itself never lives in boring.json."
        },
        "bootstrap": {
          "type": "string",
          "enum": [
            "auto",
            "manual"
          ],
          "default": "auto",
          "description": "auto = bootstrap may start a daemon / pull models. manual = health-check only, never serve/pull (user owns the server, e.g. LM Studio)."
        }
      },
      "additionalProperties": false
    },
    "embed_model": {
      "type": "string",
      "default": "bge-m3",
      "description": "DEPRECATED (v1) — use llm.embed_model. Still honored as a fallback when llm.embed_model is unset."
    },
    "embed_dim": {
      "type": "integer",
      "minimum": 1,
      "default": 1024,
      "description": "DEPRECATED (v1) — use llm.embed_dim. Still honored as a fallback when llm.embed_dim is unset."
    },
    "allow_company_origin": {
      "type": "boolean",
      "default": false,
      "description": "When true, origin:company notes (session experience from company work) are accepted corpus and do not flip the audit 'clean' flag. Default false flags them for review. Governs session experience only — company KB originals stay off-policy."
    },
    "repos": {
      "type": "array",
      "default": [],
      "items": {
        "type": "object",
        "required": [
          "match",
          "origin"
        ],
        "properties": {
          "match": {
            "type": "string",
            "description": "Case-insensitive substring matched against git remote URL first, then cwd."
          },
          "origin": {
            "type": "string",
            "enum": [
              "personal",
              "company",
              "mirror",
              "community"
            ]
          },
          "name": {
            "type": "string",
            "description": "Optional repo slug override."
          }
        },
        "additionalProperties": false
      }
    },
    "hermes_cron_jobs": {
      "type": "object",
      "default": {
        "weekly-briefing": {
          "enabled": true,
          "schedule": "0 9 * * 1",
          "script": "weekly-briefing.py"
        }
      },
      "description": "Managed hermes-agent cron jobs keyed by job name. Jobs not listed here are left untouched. An empty object disables managed jobs.",
      "patternProperties": {
        "^[a-z0-9-]+$": {
          "type": "object",
          "required": [
            "enabled",
            "schedule",
            "script"
          ],
          "properties": {
            "enabled": {
              "type": "boolean",
              "default": true
            },
            "schedule": {
              "type": "string",
              "default": "0 9 * * 1",
              "description": "Cron expression (minute hour dom mon dow). Currently only '* *' dom/mon and specific dow are fully supported."
            },
            "script": {
              "type": "string",
              "default": "weekly-briefing.py",
              "description": "Script name under ~/.hermes/scripts/."
            }
          },
          "additionalProperties": false
        }
      },
      "additionalProperties": false
    },
    "agents": {
      "type": "array",
      "default": [],
      "items": {
        "type": "object",
        "required": [
          "id",
          "enabled"
        ],
        "properties": {
          "id": {
            "type": "string",
            "enum": [
              "claude-code",
              "cursor",
              "codex",
              "windsurf",
              "claude-desktop",
              "hermes-agent",
              "kimi"
            ]
          },
          "enabled": {
            "type": "boolean",
            "default": true
          },
          "format": {
            "type": "string"
          },
          "paths": {
            "type": "array",
            "items": {
              "type": "string"
            }
          },
          "settings_path": {
            "type": "string",
            "description": "Optional agent settings file path override (e.g. MCP config or Claude Code settings.json). ~ expansion supported."
          },
          "adapter": {
            "type": "string",
            "enum": [
              "session-end",
              "prompt-submit",
              "mcp-only",
              "cron"
            ],
            "description": "How this agent is wired. Inferred when omitted."
          }
        },
        "additionalProperties": false
      }
    },
    "code_index": {
      "type": "object",
      "default": {
        "enabled": false,
        "languages": [
          "rust",
          "python",
          "typescript",
          "kotlin"
        ],
        "max_symbols_per_file": 200,
        "exclude_paths": [
          "target",
          "node_modules",
          "__pycache__",
          ".git"
        ]
      },
      "description": "AST code-graph indexer (tree-sitter). When enabled, `make code-index` parses Rust/Python sources and upserts code symbols/relations into the graph store (requires BORING_VECTOR=on).",
      "properties": {
        "enabled": {
          "type": "boolean",
          "default": false,
          "description": "Master switch. When false, code indexing is skipped entirely."
        },
        "languages": {
          "type": "array",
          "items": {
            "type": "string",
            "enum": [
              "rust",
              "python",
              "typescript",
              "kotlin"
            ]
          },
          "default": [
            "rust",
            "python",
            "typescript",
            "kotlin"
          ],
          "description": "Languages to index. Empty = all supported languages."
        },
        "max_symbols_per_file": {
          "type": "integer",
          "minimum": 1,
          "default": 200,
          "description": "Cap on symbols per file to keep the graph bounded."
        },
        "exclude_paths": {
          "type": "array",
          "items": {
            "type": "string"
          },
          "default": [
            "target",
            "node_modules",
            "__pycache__",
            ".git"
          ],
          "description": "Excluded from indexing. Entries without '/' match any path component at any depth; entries with '/' are root-relative prefixes."
        }
      }
    }
  },
  "additionalProperties": false
}
